category,question,answer
Produk,Apa produk yang dijual?,Kami menjual software WhatsApp marketing dan plugin WordPress.
Pembayaran,Bagaimana cara bayar?,Transfer bank atau QRIS. Konfirmasi ke admin setelah bayar.
Pengiriman,Berapa lama produk dikirim?,Produk digital dikirim via email maksimal 10 menit setelah pembayaran.
Support,Bagaimana cara dapat bantuan?,Hubungi admin di WhatsApp 08123456789 atau email support@domain.com.
Garansi,Apakah ada garansi?,Ya, garansi 30 hari untuk bug. Tidak termasuk kesalahan konfigurasi pengguna.
